Sheet: Script
A1: =MID( CELL("filename",R1C1),
FIND("[", CELL("filename",R1C1)) +1,
FIND("]", CELL("filename",R1C1)) - FIND("[", CELL("filename",R1C1)) -1) -> TypingRoguelike.xml
A4: index | B4: Id | C4: Group | D4: GroupList | E4: RestrictionId | F4: TimePerChar | G4: WaveCount | H4: RequiredScorePerChar | I4: SelectionMethod | J4: IsEnableRestriction | K4: IsEnableTimeUp | L4: IsEnableWave | M4: IsEnableScore | N4: IsEnableRoman | O4: IsEnableCapital
A5: =ROW()-5 -> 0 | B5: 901000Test | C5: 900000TestAct | D5: 204000Typing | F5: 1 | G5: 2 | H5: 90 | I5: Descend | J5: 1 | K5: 1 | L5: 1 | M5: 1 | N5: 0 | O5: 1
A6: =ROW()-5 -> 1 | B6: 902000Test | C6: 900000TestAct | D6: 501000Typing | E6: FrequencyGroup3 | F6: 1 | G6: 2 | H6: 95 | I6: Random | J6: 1 | K6: 1 | L6: 1 | M6: 1 | N6: 0 | O6: 1
A7: =ROW()-5 -> 2 | B7: 903000Test | C7: 900000TestAct | D7: 501000Typing | E7: FrequencyGroup2 | F7: 1 | G7: 2 | H7: 100 | I7: Random | J7: 1 | K7: 1 | L7: 1 | M7: 1 | N7: 0 | O7: 1
A8: =ROW()-5 -> 3 | B8: 904000Test | C8: 900000TestAct | D8: 501000Typing | E8: FrequencyGroup1 | F8: 1 | G8: 3 | H8: 110 | I8: Random | J8: 1 | K8: 1 | L8: 1 | M8: 1 | N8: 0 | O8: 1
A9: =ROW()-5 -> 4 | B9: 911000Test | C9: 901000TestAct | D9: 502000Typing | F9: 1 | G9: 2 | H9: 90 | I9: Random | J9: 1 | K9: 1 | L9: 1 | M9: 1 | N9: 0 | O9: 1
A10: =ROW()-5 -> 5 | B10: 912000Test | C10: 901000TestAct | D10: 502000Typing | E10: FrequencyGroup3 | F10: 1 | G10: 2 | H10: 95 | I10: Random | J10: 1 | K10: 1 | L10: 1 | M10: 1 | N10: 0 | O10: 1
A11: =ROW()-5 -> 6 | B11: 913000Test | C11: 901000TestAct | D11: 502000Typing | E11: FrequencyGroup2 | F11: 1 | G11: 2 | H11: 100 | I11: Random | J11: 1 | K11: 1 | L11: 1 | M11: 1 | N11: 0 | O11: 1
A12: =ROW()-5 -> 7 | B12: 914000Test | C12: 901000TestAct | D12: 502000Typing | E12: FrequencyGroup1 | F12: 1 | G12: 3 | H12: 110 | I12: Random | J12: 1 | K12: 1 | L12: 1 | M12: 1 | N12: 0 | O12: 1
A13: =ROW()-5 -> 8 | B13: 922000Test | C13: 922000Test | D13: 922000Test | F13: 1 | G13: 2 | H13: 110 | I13: Descend | J13: 1 | K13: 1 | L13: 1 | M13: 0 | N13: 1 | O13: 1
A14: =ROW()-5 -> 9 | B14: 923000Test | C14: 922000Test | D14: 501000Typing | F14: 1 | G14: 10 | H14: 110 | I14: Random | J14: 1 | K14: 1 | L14: 1 | M14: 0 | N14: 1 | O14: 1
A15: =ROW()-5 -> 10 | B15: 202000Typing | C15: =RC[-1] -> 202000Typing | D15: =RC[-2] -> 202000Typing | F15: 1 | G15: 2 | H15: 90 | I15: Descend | J15: 0 | K15: 0 | L15: 0 | M15: 0 | N15: 1 | O15: 1
A16: =ROW()-5 -> 11 | B16: 204000Typing | C16: =RC[-1] -> 204000Typing | D16: =RC[-2] -> 204000Typing | F16: 1 | G16: 2 | H16: 90 | I16: Descend | J16: 0 | K16: 0 | L16: 0 | M16: 0 | N16: 0 | O16: 0
A17: =ROW()-5 -> 12 | B17: 206000Typing | C17: =RC[-1] -> 206000Typing | D17: =RC[-2] -> 206000Typing | F17: 1 | G17: 2 | H17: 90 | I17: Descend | J17: 0 | K17: 0 | L17: 0 | M17: 0 | N17: 0 | O17: 0
A18: =ROW()-5 -> 13 | B18: 208000Typing | C18: =RC[-1] -> 208000Typing | D18: =RC[-2] -> 208000Typing | F18: 1 | G18: 2 | H18: 90 | I18: Descend | J18: 0 | K18: 0 | L18: 0 | M18: 0 | N18: 0 | O18: 0
A19: =ROW()-5 -> 14 | B19: 210000Typing | C19: =RC[-1] -> 210000Typing | D19: =RC[-2] -> 210000Typing | F19: 1 | G19: 2 | H19: 90 | I19: Descend | J19: 0 | K19: 0 | L19: 0 | M19: 0 | N19: 0 | O19: 0
A20: =ROW()-5 -> 15 | B20: 213000Typing | C20: =RC[-1] -> 213000Typing | D20: =RC[-2] -> 213000Typing | F20: 1 | G20: 2 | H20: 90 | I20: Descend | J20: 0 | K20: 0 | L20: 0 | M20: 0 | N20: 0 | O20: 0
A21: =ROW()-5 -> 16 | B21: 215000Typing | C21: =RC[-1] -> 215000Typing | D21: =RC[-2] -> 215000Typing | F21: 1 | G21: 2 | H21: 90 | I21: Descend | J21: 0 | K21: 0 | L21: 0 | M21: 0 | N21: 0 | O21: 0
A22: =ROW()-5 -> 17 | B22: 304000Typing | C22: 304000Act | D22: =RC[-2] -> 304000Typing | F22: 1 | G22: 2 | H22: 90 | I22: Descend | J22: 0 | K22: 0 | L22: 1 | M22: 0 | N22: 0 | O22: 1
A23: =ROW()-5 -> 18 | B23: 304500Typing | C23: 304000Act | D23: 304500Typing | F23: 1 | G23: 3 | H23: 90 | I23: Descend | J23: 0 | K23: 0 | L23: 1 | M23: 0 | N23: 0 | O23: 1
A24: =ROW()-5 -> 19 | B24: 308000Typing | C24: 304000Act | D24: =RC[-2] -> 308000Typing | F24: 1 | G24: 3 | H24: 90 | I24: Descend | J24: 0 | K24: 0 | L24: 1 | M24: 0 | N24: 0 | O24: 1
A25: =ROW()-5 -> 20 | B25: 311000Typing | C25: 304000Act | D25: =RC[-2] -> 311000Typing | F25: 1 | G25: 2 | H25: 90 | I25: Descend | J25: 0 | K25: 0 | L25: 0 | M25: 0 | N25: 0 | O25: 1
A26: =ROW()-5 -> 21 | B26: 320000Typing | C26: 320000TestAct | D26: =RC[-2] -> 320000Typing | F26: 1 | G26: 2 | H26: 90 | I26: Descend | J26: 0 | K26: 0 | L26: 1 | M26: 0 | N26: 0 | O26: 1
A27: =ROW()-5 -> 22 | B27: 332000Typing | C27: 320000TestAct | D27: =RC[-2] -> 332000Typing | F27: 1 | G27: 2 | H27: 90 | I27: Descend | J27: 0 | K27: 0 | L27: 0 | M27: 0 | N27: 0 | O27: 1
A28: =ROW()-5 -> 23 | B28: 340000Typing | C28: 320000TestAct | D28: =RC[-2] -> 340000Typing | F28: 1 | G28: 2 | H28: 90 | I28: Descend | J28: 0 | K28: 0 | L28: 0 | M28: 0 | N28: 0 | O28: 1
A29: =ROW()-5 -> 24 | B29: 960000Typing | C29: =RC[-1] -> 960000Typing | D29: =RC[-2] -> 960000Typing | F29: 1 | G29: 1 | H29: 90 | I29: Descend | J29: 0 | K29: 0 | L29: 0 | M29: 0 | N29: 0 | O29: 1

Sheet: 凡例
C1: SePath
C2: Sound/SE/

Sheet: Template
A1: =MID( CELL("filename",R1C1),
FIND("[", CELL("filename",R1C1)) +1,
FIND("]", CELL("filename",R1C1)) - FIND("[", CELL("filename",R1C1)) -1) -> TypingRoguelike.xml
A4: index | B4: Id | C4: SePath
A5: 0 | B5: Enter | C5: =CONCAT(凡例!R2C,Script!#REF!) -> #REF!
A6: 1 | B6: Walk | C6: =CONCAT(凡例!R2C,Script!#REF!) -> #REF!
A7: 2 | B7: Text | C7: =CONCAT(凡例!R2C,Script!#REF!) -> #REF!
A8: 3 | B8: Cursor | C8: =CONCAT(凡例!R2C,Script!#REF!) -> #REF!
A9: 4 | B9: Telop | C9: =CONCAT(凡例!R2C,Script!#REF!) -> #REF!