Sheet: Script
A1: =MID( CELL("filename",R1C1),
FIND("[", CELL("filename",R1C1)) +1,
FIND("]", CELL("filename",R1C1)) - FIND("[", CELL("filename",R1C1)) -1) -> LanguageMessage.xml
A4: index | B4: Id | C4: Japanese | D4: English
A5: =ROW()-5 -> 0 | B5: SettingTitle | C5: 設定 | D5: Settings
A6: =ROW()-5 -> 1 | B6: SettingLabelProfile | C6: プロフィール | D6: Profile
A7: =ROW()-5 -> 2 | B7: SettingLabelAdvanced | C7: 高度な設定 | D7: Advanced Settings
A8: =ROW()-5 -> 3 | B8: SettingLabelKeyConfig | C8: キーコンフィグ | D8: Key Config
A9: =ROW()-5 -> 4 | B9: SettingLabelGraphic | C9: グラフィック | D9: Graphics
A10: =ROW()-5 -> 5 | B10: SettingLabelOther | C10: その他 | D10: Other
A11: =ROW()-5 -> 6 | B11: SettingProfileName | C11: 名前 | D11: Name
A12: =ROW()-5 -> 7 | B12: SettingProfileBirth | C12: 生年月 | D12: Date of Birth
A13: =ROW()-5 -> 8 | B13: SettingProfileSex | C13: SEX | D13: Sex
A14: =ROW()-5 -> 9 | B14: SettingProfileEthnicity | C14: 民族 | D14: Nationality
A15: =ROW()-5 -> 10 | B15: SettingProfileConsent | C15: ゲーム内で受けるあらゆる損害 | D15: All Damage Taken in Game
A16: =ROW()-5 -> 11 | B16: SettingAdvancedRoguelike | C16: ローグライクモード | D16: Roguelike Mode
A17: =ROW()-5 -> 12 | B17: SettingAdvancedDeveloper | C17: 開発者モード | D17: Developer Mode
A18: =ROW()-5 -> 13 | B18: SettingAdvancedCaution | C18: ! ゲームに重大な影響を及ぼす可能性があります | D18: Warning: This may have a significant impact on the game.
A19: =ROW()-5 -> 14 | B19: SettingKeyConfigUp | C19: 上移動 | D19: Move Up
A20: =ROW()-5 -> 15 | B20: SettingKeyConfigLeft | C20: 左移動 | D20: Move Left
A21: =ROW()-5 -> 16 | B21: SettingKeyConfigDown | C21: 下移動 | D21: Move Down
A22: =ROW()-5 -> 17 | B22: SettingKeyConfigRight | C22: 右移動 | D22: Move Right
A23: =ROW()-5 -> 18 | B23: SettingGraphicResolution | C23: 解像度 | D23: Resolution
A24: =ROW()-5 -> 19 | B24: SettingGraphicWindow | C24: ウィンドウ | D24: Window
A25: =ROW()-5 -> 20 | B25: SettingGraphicBrightness | C25: 明るさ | D25: Brightness
A26: =ROW()-5 -> 21 | B26: SettingOtherGameEnd | C26: ゲーム終了
A27: =ROW()-5 -> 22 | B27: FakeSettingProfileName | C27: TANAKA | D27: Smith
A28: =ROW()-5 -> 23 | B28: FakeSettingProfileBirth | C28: 1994年7月 | D28: July 1994
A29: =ROW()-5 -> 24 | B29: FakeSettingProfileSex | C29: 不明 | D29: Unknown
A30: =ROW()-5 -> 25 | B30: FakeSettingProfileEthnicity | C30: JAPANESE | D30: USA
A31: =ROW()-5 -> 26 | B31: FakeSettingProfileConsent | C31: 承諾済み | D31: Accepted
A32: =ROW()-5 -> 27 | B32: SkillCategoryLeet | C32: 特殊 | D32: Sp.
A33: =ROW()-5 -> 28 | B33: SkillCategoryAnimal | C33: 動物 | D33: Ani.
A34: =ROW()-5 -> 29 | B34: SkillCategoryHuman | C34: 人 | D34: Hum.
A35: =ROW()-5 -> 30 | B35: SkillCategoryVi | C35: 自動詞 | D35: Vi.
A36: =ROW()-5 -> 31 | B36: SkillCategoryVt | C36: 他動詞 | D36: Vt.
A37: =ROW()-5 -> 32 | B37: ExhibitionClear | C37: プロトタイプ版のプレイ、ありがとうございました！ "DYPING ESCAPE"はこれからも大幅にコンテンツを追加し、 Steamにてリリース予定です。 右下のQRコードより、ウィッシュリスト登録で 応援いただけると、大変励みになります！！ お手数ですが、このままゲームを強制終了してください。 | D37: Thank you for playing the prototype version! We will continue to add substantial content to "DYPING ESCAPE", which is planned for release on Steam. If you could support us by adding the game to your wishlist via the QR code in the bottom right, it would mean a lot to us!! Sorry for the inconvenience, but please force close the game now.
A38: =ROW()-5 -> 33 | B38: SelectInput1 | C38: はい | D38: Yes
A39: =ROW()-5 -> 34 | B39: SelectInput2 | C39: Yes | D39: Hai
A40: =ROW()-5 -> 35 | B40: GameoverCaption | C40: 再挑戦： Enter or <sprite name=space>(Space) タイトル： Backspace | D40: Restart: Enter or <sprite name=space>(Space) Return to Title: Backspace
A41: =ROW()-5 -> 36 | B41: Hour | C41: 時 | D41: :
A42: =ROW()-5 -> 37 | B42: Minute | C42: 分 | D42: :
A43: =ROW()-5 -> 38 | B43: Second | C43: 秒

Sheet: 凡例
C1: SePath
C2: Sound/SE/

Sheet: Template
A1: =MID( CELL("filename",R1C1),
FIND("[", CELL("filename",R1C1)) +1,
FIND("]", CELL("filename",R1C1)) - FIND("[", CELL("filename",R1C1)) -1) -> LanguageMessage.xml
A4: index | B4: Id | C4: SePath
A5: 0 | B5: Enter | C5: =CONCAT(凡例!R2C,Script!#REF!) -> #REF!
A6: 1 | B6: Walk | C6: =CONCAT(凡例!R2C,Script!#REF!) -> #REF!
A7: 2 | B7: Text | C7: =CONCAT(凡例!R2C,Script!#REF!) -> #REF!
A8: 3 | B8: Cursor | C8: =CONCAT(凡例!R2C,Script!#REF!) -> #REF!
A9: 4 | B9: Telop | C9: =CONCAT(凡例!R2C,Script!#REF!) -> #REF!