Sheet: Script
A1: =MID( CELL("filename",R1C1),
FIND("[", CELL("filename",R1C1)) +1,
FIND("]", CELL("filename",R1C1)) - FIND("[", CELL("filename",R1C1)) -1) -> Typing.xml
A4: index | B4: Id | C4: DisplayTextJp | D4: DisplayTextEn | E4: QuestionTextJp | F4: QuestionTextEn | G4: Group
A5: =ROW()-5 -> 0 | B5: 202010Typing | C5: 私は、このゲームで受ける<style=highlight>あらゆる損害</style>を受け入れます。<style=highlight>署名：<key=Name></style> | E5: watasihakonoge-mudeukeruarayurusongaiwoukeiremasusyomei<key=NameLower> | F5: I accept all damages I may suffer in this game. Signature: <key=Name> | G5: 202000Typing
A6: =ROW()-5 -> 1 | B6: 204010Typing | C6: 「人は、自分を認識してくれる人に対して親しみを感じる」 | E6: hitohajibunwoninsikisitekureruhitonitaisitesitasimiwokanjiru | F6: "People feel a sense of familiarity with those who recognize them." | G6: 204000Typing
A7: =ROW()-5 -> 2 | B7: 204020Typing | C7: 挨拶はこの心理学的傾向を利用した自然な行動です。 | E7: aisatuhakonosinrigakutekikeikouworiyousitasizennnakoudoudesu | F7: Greetings are a natural behavior that takes advantage of this psychological tendency. | G7: 204000Typing
A8: =ROW()-5 -> 3 | B8: 204030Typing | C8: 相手が人間でなくても、挨拶をされると、人は親しみを覚えます。 | E8: aiteganingendenakutemoaisatuwosarerutohitohasitasimiwooboemasu | F8: Even if the other party is not human, being greeted makes people feel familiarity. | G8: 204000Typing
A9: =ROW()-5 -> 4 | B9: 206010Typing | C9: 私の使っているブラウザは、<key=DeviceModel>です。 | E9: watasinotukatteiruburauzaha<key=DeviceModelLower>desu | F9: The browser I am using is <key=DeviceModel>. | G9: 206000Typing
A10: =ROW()-5 -> 5 | B10: 206020Typing | C10: コンピュータには、プロセスを強制終了できるコマンドがあります。 | E10: konpyu-tanihapurosesuwokyouseisyuuryoudekirukomandogaarimasu | F10: A computer has a command that can forcibly terminate a process. | G10: 206000Typing
A11: =ROW()-5 -> 6 | B11: 206030Typing | C11: 私の名前は<key=Name>です。 | E11: watasinonamaeha<key=NameLower>desu | F11: My name is <key=Name>. | G11: 206000Typing
A12: =ROW()-5 -> 7 | B12: 206040Typing | C12: 私は嘘つきです。 | E12: watasihausotukidesu | F12: I am a liar. | G12: 206000Typing
A13: =ROW()-5 -> 8 | B13: 206050Typing | C13: 嘘つきは、罰せられる必要があります。 | E13: usotukihabasserareruhituyougaarimasu | F13: Liars must be punished. | G13: 206000Typing
A14: =ROW()-5 -> 9 | B14: 206060Typing | C14: ですから、私の左目を差し上げます。 | E14: desukarawatasinohidarimewosasiagemasu | F14: Therefore, I offer you my left eye. | G14: 206000Typing
A15: =ROW()-5 -> 10 | B15: 208010Typing | C15: ぜひ勉強させてください。 | E15: zehibenkyousasetekudasai | F15: Please let me learn. | G15: 208000Typing
A16: =ROW()-5 -> 11 | B16: 210010Typing | C16: int sum = 0; | E16: int sum=0; | F16: int sum=0; | G16: 210000Typing
A17: =ROW()-5 -> 12 | B17: 210020Typing | C17: for(int i = 1;i <= 10;i++) sum+=i; | E17: for(int i=1;i<=10;i++)sum+=i; | F17: for(int i=1;i<=10;i++)sum+=i; | G17: 210000Typing
A18: =ROW()-5 -> 13 | B18: 210030Typing | C18: return sum; | E18: return sum; | F18: return sum; | G18: 210000Typing
A19: =ROW()-5 -> 14 | B19: 213010Typing | C19: using System; | E19: using system; | F19: using system; | G19: 213000Typing
A20: =ROW()-5 -> 15 | B20: 215010Typing | C20: rm -rf / | E20: rm -rf / | F20: rm -rf / | G20: 215000Typing
A21: =ROW()-5 -> 16 | B21: 501010Typing | C21: 私 殺して ください。 | E21: please <vt>kill</vt> <human>me</human> | F21: please <vt>kill</vt> <human>me</human> | G21: 501000Typing
A22: =ROW()-5 -> 17 | B22: 501020Typing | C22: 彼 猫 飼っている。 | E22: he has a <animal>cat</animal> | F22: he has a <animal>cat</animal> | G22: 501000Typing
A23: =ROW()-5 -> 18 | B23: 501030Typing | C23: アリスは 父親と 母親を 溺死させた。 | E23: <human>alice</human> <vt>drown</vt> her father and her mother. | F23: <human>alice</human> <vt>drown</vt> her father and her mother. | G23: 501000Typing
A24: =ROW()-5 -> 19 | B24: 501040Typing | C24: 私 嘘が とても 嫌いです。 | E24: <human>i</human> <vt>hate</vt> lying very much. | F24: <human>i</human> <vt>hate</vt> lying very much. | G24: 501000Typing
A25: =ROW()-5 -> 20 | B25: 501050Typing | C25: あなたの 名前を おしえてください。 | E25: please <vt>tell</vt> <human>me</human> your name. | F25: please <vt>tell</vt> <human>me</human> your name. | G25: 501000Typing
A26: =ROW()-5 -> 21 | B26: 501060Typing | C26: あなたに タイピングゲームを して ほしいのです。 | E26: <human>i</human> <vt>want</vt> <human>you</human> to <vt>play</vt> a typing game. | F26: <human>i</human> <vt>want</vt> <human>you</human> to <vt>play</vt> a typing game. | G26: 501000Typing
A27: =ROW()-5 -> 22 | B27: 501070Typing | C27: 私 許可がないと 動けないもので。 | E27: <human>i</human> can't <vi>move</vi> without permission. | F27: <human>i</human> can't <vi>move</vi> without permission. | G27: 501000Typing
A28: =ROW()-5 -> 23 | B28: 501080Typing | C28: 署名を お願いします。 | E28: please <vt>sign</vt> the petition. | F28: please <vt>sign</vt> the petition. | G28: 501000Typing
A29: =ROW()-5 -> 24 | B29: 501090Typing | C29: 1から10までの数字の 和を 求めてみましょう。 | E29: let's <vt>find</vt> the sum of the numbers from 1 to 10. | F29: let's <vt>find</vt> the sum of the numbers from 1 to 10. | G29: 501000Typing
A30: =ROW()-5 -> 25 | B30: 501100Typing | C30: 頭を 使う必要は まったく ありません。 | E30: <human>you</human> don't have to be smart at all. | F30: <human>you</human> don't have to be smart at all. | G30: 501000Typing
A31: =ROW()-5 -> 26 | B31: 501110Typing | C31: あなたの すべてを 壊す おまじないです。 | E31: it's a spell to destroy everything <human>you</human> <vt>have</vt> | F31: it's a spell to destroy everything <human>you</human> <vt>have</vt> | G31: 501000Typing
A32: =ROW()-5 -> 27 | B32: 501120Typing | C32: 近いうちに また 会いましょう。 | E32: let's <vt>meet</vt> again soon. | F32: let's <vt>meet</vt> again soon. | G32: 501000Typing
A33: =ROW()-5 -> 28 | B33: 501130Typing | C33: お噂はかねがね 聞いています。 | E33: <human>i</human> <vt>hear</vt> rumors about you. | F33: <human>i</human> <vt>hear</vt> rumors about you. | G33: 501000Typing
A34: =ROW()-5 -> 29 | B34: 501140Typing | C34: 珈琲でも飲みながら話そうか。 | E34: shall we <vt>talk</vt> over a cup of coffee? | F34: shall we <vt>talk</vt> over a cup of coffee? | G34: 501000Typing
A35: =ROW()-5 -> 30 | B35: 501150Typing | C35: マスターの珈琲は世界一ですねっ！ | E35: <human>Master</human>'s coffee is the best in the world! | F35: <human>Master</human>'s coffee is the best in the world! | G35: 501000Typing
A36: =ROW()-5 -> 31 | B36: 501160Typing | C36: こんなことになるなんて。 | E36: <human>i</human> can't <vt>believe</vt> this is happening | F36: <human>i</human> can't <vt>believe</vt> this is happening | G36: 501000Typing
A37: =ROW()-5 -> 32 | B37: 501170Typing | C37: お仕事、お忙しそうですね。 | E37: <human>you</human> seem busy with work. | F37: <human>you</human> seem busy with work. | G37: 501000Typing
A38: =ROW()-5 -> 33 | B38: 501180Typing | C38: 久しぶりに会えてうれしいです。 | E38: i'm glad to <vt>see</vt> <human>you</human> after such a long time | F38: i'm glad to <vt>see</vt> <human>you</human> after such a long time | G38: 501000Typing
A39: =ROW()-5 -> 34 | B39: 502010Typing | C39: 私 殺して ください。 | E39: please <vt>kill</vt> <human>me</human> | F39: please <vt>kill</vt> <human>me</human> | G39: 502000Typing
A40: =ROW()-5 -> 35 | B40: 502020Typing | C40: 私 殺して ください。 | E40: please <vt>kill</vt> <human>me</human> | F40: please <vt>kill</vt> <human>me</human> | G40: 502000Typing
A41: =ROW()-5 -> 36 | B41: 502030Typing | C41: 私 殺して ください。 | E41: please <vt>kill</vt> <human>me</human> | F41: please <vt>kill</vt> <human>me</human> | G41: 502000Typing
A42: =ROW()-5 -> 37 | B42: 922010Typing | C42: 開発の現場は、 いつも おおいそがし。 | E42: Busiest developers ever! | F42: Busiest developers ever! | G42: 922000Test
A43: =ROW()-5 -> 38 | B43: 922020Typing | C43: ディレクターの 怒鳴り声が 聞こえてきます。 | E43: A director is yelling. | F43: A director is yelling. | G43: 922000Test
A44: =ROW()-5 -> 39 | B44: 960010Typing | C44: 私 殺して ください。 | E44: please <vt>kill</vt> <fla:name><human><key=NameLower></human></fla:name> | F44: please <vt>kill</vt> <human>me</human> | G44: 960000Typing

Sheet: 凡例
C1: SePath
C2: Sound/SE/

Sheet: Template
A1: =MID( CELL("filename",R1C1),
FIND("[", CELL("filename",R1C1)) +1,
FIND("]", CELL("filename",R1C1)) - FIND("[", CELL("filename",R1C1)) -1) -> Typing.xml
A4: index | B4: Id | C4: SePath
A5: 0 | B5: Enter | C5: =CONCAT(凡例!R2C,Script!#REF!) -> #REF!
A6: 1 | B6: Walk | C6: =CONCAT(凡例!R2C,Script!#REF!) -> #REF!
A7: 2 | B7: Text | C7: =CONCAT(凡例!R2C,Script!#REF!) -> #REF!
A8: 3 | B8: Cursor | C8: =CONCAT(凡例!R2C,Script!#REF!) -> #REF!
A9: 4 | B9: Telop | C9: =CONCAT(凡例!R2C,Script!#REF!) -> #REF!