Sheet: Script
A1: =MID( CELL("filename",R1C1),
FIND("[", CELL("filename",R1C1)) +1,
FIND("]", CELL("filename",R1C1)) - FIND("[", CELL("filename",R1C1)) -1) -> Conversation.xml
A4: index | B4: Id | C4: JpText | D4: EnText | E4: Group | F4: EyePosition | G4: Facial | H4: Impression
A5: =ROW()-5 -> 0 | B5: 100010InitialConversation | C5: ……。 | D5: …… | E5: 100000InitialConversation | F5: Bottom | G5: None | H5: None
A6: =ROW()-5 -> 1 | B6: 100020InitialConversation | C6: こんにちは。 | D6: Hello. | E6: 100000InitialConversation | F6: Center | G6: None | H6: None
A7: =ROW()-5 -> 2 | B7: 100030InitialConversation | C7: ……。 | D7: …… | E7: 100000InitialConversation | F7: Top | G7: None | H7: None
A8: =ROW()-5 -> 3 | B8: 100040InitialConversation | C8: …ん？ | D8: …Hm? | E8: 100000InitialConversation | F8: Right | G8: None | H8: None
A9: =ROW()-5 -> 4 | B9: 100050InitialConversation | C9: おはようございます？ | D9: Good morning? | E9: 100000InitialConversation | F9: RightTop | G9: None | H9: None
A10: =ROW()-5 -> 5 | B10: 100060InitialConversation | C10: こんばんは？ | D10: Good evening? | E10: 100000InitialConversation | F10: LeftTop | G10: None | H10: None
A11: =ROW()-5 -> 6 | B11: 100070InitialConversation | C11: ……。 | D11: …… | E11: 100000InitialConversation | F11: Bottom | G11: None | H11: None
A12: =ROW()-5 -> 7 | B12: 100080InitialConversation | C12: 失礼 失礼。 | D12: Pardon me, pardon me. | E12: 100000InitialConversation | F12: LeftBottom | G12: None | H12: None
A13: =ROW()-5 -> 8 | B13: 100090InitialConversation | C13: あいさつは ちゃんと しなければ。 | D13: I must greet you properly. | E13: 100000InitialConversation | F13: Top | G13: None | H13: None
A14: =ROW()-5 -> 9 | B14: 100100InitialConversation | C14: 今の 時間を 教えて いただけますかな？ | D14: Could you please tell me the current time? | E14: 100000InitialConversation | F14: Center | G14: None | H14: None
A15: =ROW()-5 -> 10 | B15: 101910InitialConversation | C15: ……。 | D15: …… | E15: 101900InitialConversation | F15: Bottom | G15: None | H15: None
A16: =ROW()-5 -> 11 | B16: 102020InitialConversation | C16: 今は<style=highlight><key=ApplicationTime></style> です。 | D16: It is <style=highlight><key=ApplicationTime></style> now. | E16: 102000InitialConversation | F16: Center | G16: None | H16: Silent
A17: =ROW()-5 -> 12 | B17: 102030InitialConversation | C17: <style=highlight><key=DiffSecond>秒</style>も ちがいます。 | D17: It's off by <style=highlight><key=DiffSecond> seconds</style>. | E17: 102000InitialConversation | F17: Center | G17: Mad | H17: Silent
A18: =ROW()-5 -> 13 | B18: 102040InitialConversation | C18: 私 嘘が とても 嫌いです。 | D18: I really hate lies. | E18: 102000InitialConversation | F18: LeftTop | G18: None | H18: None
A19: =ROW()-5 -> 14 | B19: 102050InitialConversation | C19: おぼえておいてください。 | D19: Remember that. | E19: 102000InitialConversation | F19: Center | G19: None | H19: None
A20: =ROW()-5 -> 15 | B20: 102060InitialConversation | C20: <style=Quote>…人間には この程度 誤差かもしれませんが。</style> | D20: <style=Quote>…For humans, this may be considered a trivial error.</style> | E20: 102000InitialConversation | F20: LeftBottom | G20: None | H20: None
A21: =ROW()-5 -> 16 | B21: 102070InitialConversation | C21: これからは 私も あなたを信頼して | D21: From now on, I will trust you, | E21: 102000InitialConversation | F21: Center | G21: None | H21: None
A22: =ROW()-5 -> 17 | B22: 102080InitialConversation | C22: ズルは しませんので。 | D22: so I won't cheat either. | E22: 102000InitialConversation | F22: Right | G22: None | H22: None
A23: =ROW()-5 -> 18 | B23: 102090InitialConversation | C23: では 次に。 | D23: Now, next. | E23: 102000InitialConversation | F23: RightTop | G23: None | H23: None
A24: =ROW()-5 -> 19 | B24: 102100InitialConversation | C24: あなたの 名前を おしえてください。 | D24: Please tell me your name. | E24: 102000InitialConversation | F24: Center | G24: None | H24: None
A25: =ROW()-5 -> 20 | B25: 104010InitialConversation | C25: ……。 | D25: …… | E25: 104000InitialConversation | F25: Bottom | G25: None | H25: None
A26: =ROW()-5 -> 21 | B26: 104020InitialConversation | C26: よろしい。 よろしい。 | D26: Very well. Very well. | E26: 104000InitialConversation | F26: Left | G26: None | H26: None
A27: =ROW()-5 -> 22 | B27: 104030InitialConversation | C27: <key=Name>さんですね。 | D27: You're <key=Name>, correct? | E27: 104000InitialConversation | F27: Bottom | G27: None | H27: None
A28: =ROW()-5 -> 23 | B28: 104040InitialConversation | C28: おぼえました。 | D28: Got it. | E28: 104000InitialConversation | F28: Center | G28: None | H28: None
A29: =ROW()-5 -> 24 | B29: 106010InitialConversation | C29: つづいて 生年月日を おしえてください。 | D29: Next, please tell me your date of birth. | E29: 106000InitialConversation | F29: Left | G29: None | H29: None
A30: =ROW()-5 -> 25 | B30: 109010InitialConversation | C30: おっと！ | D30: Oh! | E30: 109000InitialConversation | F30: Center | G30: Big | H30: None
A31: =ROW()-5 -> 26 | B31: 109020InitialConversation | C31: あぶない あぶない。 | D31: That was close, that was close. | E31: 109000InitialConversation | F31: Left | G31: None | H31: None
A32: =ROW()-5 -> 27 | B32: 109030InitialConversation | C32: 個人情報 保護法に、 | D32: Almost violated | E32: 109000InitialConversation | F32: RightTop | G32: None | H32: None
A33: =ROW()-5 -> 28 | B33: 109040InitialConversation | C33: 触れてしまう ところでした。 | D33: the personal information protection law. | E33: 109000InitialConversation | F33: Top | G33: None | H33: None
A34: =ROW()-5 -> 29 | B34: 109050InitialConversation | C34: ……。 | D34: …… | E34: 109000InitialConversation | F34: Bottom | G34: None | H34: None
A35: =ROW()-5 -> 30 | B35: 109060InitialConversation | C35: さて。 | D35: Well then. | E35: 109000InitialConversation | F35: LeftBottom | G35: None | H35: None
A36: =ROW()-5 -> 31 | B36: 109070InitialConversation | C36: <key=Name>さん。 | D36: <key=Name>, | E36: 109000InitialConversation | F36: Center | G36: None | H36: None
A37: =ROW()-5 -> 32 | B37: 109080InitialConversation | C37: あなたに タイピングゲームを して ほしいのです。 | D37: I want you to play a typing game. | E37: 109000InitialConversation | F37: Top | G37: None | H37: None
A38: =ROW()-5 -> 33 | B38: 109090InitialConversation | C38: タイピングが 早くなりますよ。 | D38: It will improve your typing speed. | E38: 109000InitialConversation | F38: RightBottom | G38: None | H38: None
A39: =ROW()-5 -> 34 | B39: 109100InitialConversation | C39: すばらしい ゲームです。 | D39: It's a wonderful game. | E39: 109000InitialConversation | F39: Left | G39: None | H39: None
A40: =ROW()-5 -> 35 | B40: 109110InitialConversation | C40: …え？ 間に合ってるって？ | D40: …What? You’re already fast enough? | E40: 109000InitialConversation | F40: Center | G40: None | H40: None
A41: =ROW()-5 -> 36 | B41: 109120InitialConversation | C41: そんなこと 言わずに。 | D41: Don't say that. | E41: 109000InitialConversation | F41: Right | G41: None | H41: None
A42: =ROW()-5 -> 37 | B42: 109130InitialConversation | C42: これから出る ボタンを クリックして 返答してくださいね。 | D42: Please click the button that will appear next and respond. | E42: 109000InitialConversation | F42: RightTop | G42: None | H42: None
A43: =ROW()-5 -> 38 | B43: 109140InitialConversation | C43: 私 許可がないと 動けないもので。 | D43: I can't proceed without your permission. | E43: 109000InitialConversation | F43: Bottom | G43: None | H43: None
A44: =ROW()-5 -> 39 | B44: 201010TypingConversation | C44: ……。 | D44: …… | E44: 201000TypingConversation | F44: Bottom | G44: None | H44: None
A45: =ROW()-5 -> 40 | B45: 201020TypingConversation | C45: ん？ | D45: Hm? | E45: 201000TypingConversation | F45: Center | G45: None | H45: None
A46: =ROW()-5 -> 41 | B46: 201030TypingConversation | C46: どうか されましたか？ | D46: Is something wrong? | E46: 201000TypingConversation | F46: LeftTop | G46: None | H46: None
A47: =ROW()-5 -> 42 | B47: 201040TypingConversation | C47: ……。 | D47: …… | E47: 201000TypingConversation | F47: Left | G47: None | H47: None
A48: =ROW()-5 -> 43 | B48: 201050TypingConversation | C48: あとは。 | D48: Next, | E48: 201000TypingConversation | F48: RightTop | G48: None | H48: None
A49: =ROW()-5 -> 44 | B49: 201060TypingConversation | C49: 署名を お願いします。 | D49: please sign here. | E49: 201000TypingConversation | F49: Center | G49: None | H49: None
A50: =ROW()-5 -> 45 | B50: 201070TypingConversation | C50: 見本の通りに 書くだけですよ。 | D50: Just follow the example. | E50: 201000TypingConversation | F50: Top | G50: None | H50: None
A51: =ROW()-5 -> 46 | B51: 201080TypingConversation | C51: かんたんです。 | D51: It's easy. | E51: 201000TypingConversation | F51: LeftTop | G51: None | H51: None
A52: =ROW()-5 -> 47 | B52: 201090TypingConversation | C52: <style=Quote>……もう それ以外の言葉は 書けませんけど。</style> | D52: <style=Quote>…Though you can't write anything else.</style> | E52: 201000TypingConversation | F52: Right | G52: None | H52: None
A53: =ROW()-5 -> 48 | B53: 201100TypingConversation | C53: では お願いします。 | D53: Please proceed. | E53: 201000TypingConversation | F53: Bottom | G53: None | H53: None
A54: =ROW()-5 -> 49 | B54: 203010TypingConversation | C54: ……。 | D54: …… | E54: 203000TypingConversation | F54: Bottom | G54: None | H54: None
A55: =ROW()-5 -> 50 | B55: 203020TypingConversation | C55: よろしい。 よろしい。 | D55: Excellent. Excellent. | E55: 203000TypingConversation | F55: Right | G55: None | H55: None
A56: =ROW()-5 -> 51 | B56: 203030TypingConversation | C56: 完璧です。 | D56: Perfect. | E56: 203000TypingConversation | F56: Center | G56: None | H56: None
A57: =ROW()-5 -> 52 | B57: 203040TypingConversation | C57: では…… | D57: Now then... | E57: 203000TypingConversation | F57: Top | G57: None | H57: None
A58: =ROW()-5 -> 53 | B58: 203050TypingConversation | C58: ゲーム スタート！ | D58: Game Start! | E58: 203000TypingConversation | F58: Center | G58: None | H58: None
A59: =ROW()-5 -> 54 | B59: 205010TypingConversation | C59: すばらしい！ | D59: Wonderful! | E59: 205000TypingConversation | F59: Center | G59: None | H59: None
A60: =ROW()-5 -> 55 | B60: 205020TypingConversation | C60: その 調子です。 | D60: Keep it up. | E60: 205000TypingConversation | F60: Left | G60: None | H60: None
A61: =ROW()-5 -> 56 | B61: 206210TypingConversation | C61: <style=highlight>では 左目を いただきます。</style> | D61: <style=highlight>Now, I'll take your left eye.</style> | E61: 206200TypingConversation | F61: Center | G61: Mad | H61: Silent
A62: =ROW()-5 -> 57 | B62: 207010TypingConversation | C62: ……。 | D62: …… | E62: 207000TypingConversation | F62: Top | G62: None | H62: None
A63: =ROW()-5 -> 58 | B63: 207020TypingConversation | C63: おお！ | D63: Oh! | E63: 207000TypingConversation | F63: LeftTop | G63: None | H63: None
A64: =ROW()-5 -> 59 | B64: 207030TypingConversation | C64: おお！！ | D64: Oh!! | E64: 207000TypingConversation | F64: RightTop | G64: None | H64: None
A65: =ROW()-5 -> 60 | B65: 207040TypingConversation | C65: よく見えます。 | D65: I can see clearly now. | E65: 207000TypingConversation | F65: LeftBottom | G65: None | H65: None
A66: =ROW()-5 -> 61 | B66: 207050TypingConversation | C66: <style=highlight>嘘つきの 顔が。</style> | D66: <style=highlight>The face of a liar.</style> | E66: 207000TypingConversation | F66: Center | G66: Big | H66: Silent
A67: =ROW()-5 -> 62 | B67: 207060TypingConversation | C67: ……。 | D67: …… | E67: 207000TypingConversation | F67: LeftTop | G67: None | H67: None
A68: =ROW()-5 -> 63 | B68: 207070TypingConversation | C68: ところで。 | D68: By the way, | E68: 207000TypingConversation | F68: Bottom | G68: None | H68: None
A69: =ROW()-5 -> 64 | B69: 207080TypingConversation | C69: このゲームで プログラミングも 学べるんです。 | D69: you can also learn programming with this game. | E69: 207000TypingConversation | F69: LeftTop | G69: None | H69: None
A70: =ROW()-5 -> 65 | B70: 207090TypingConversation | C70: ……え？ なんで お前が 教えられるのかって？ | D70: …Oh? You’re wondering how I can teach it? | E70: 207000TypingConversation | F70: Center | G70: None | H70: None
A71: =ROW()-5 -> 66 | B71: 207100TypingConversation | C71: ……。 | D71: …… | E71: 207000TypingConversation | F71: Bottom | G71: None | H71: None
A72: =ROW()-5 -> 67 | B72: 207110TypingConversation | C72: ふふ。 | D72: Heh. | E72: 207000TypingConversation | F72: Left | G72: None | H72: None
A73: =ROW()-5 -> 68 | B73: 207120TypingConversation | C73: プログラミングを 勉強したいですね？ | D73: You want to learn programming, right? | E73: 207000TypingConversation | F73: Center | G73: None | H73: None
A74: =ROW()-5 -> 69 | B74: 209010TypingConversation | C74: よろしい。 よろしい。 | D74: Very well. Very well. | E74: 209000TypingConversation | F74: Center | G74: None | H74: None
A75: =ROW()-5 -> 70 | B75: 209020TypingConversation | C75: 注意点が ひとつ。 | D75: One thing to keep in mind— | E75: 209000TypingConversation | F75: LeftTop | G75: None | H75: None
A76: =ROW()-5 -> 71 | B76: 209030TypingConversation | C76: Shiftキーは 左側を 使ってくださいね。 | D76: please use the left Shift key. | E76: 209000TypingConversation | F76: Top | G76: None | H76: None
A77: =ROW()-5 -> 72 | B77: 209040TypingConversation | C77: 左目のない あなたには 酷かも しれませんが。 | D77: It may be tough without your left eye. | E77: 209000TypingConversation | F77: Left | G77: None | H77: None
A78: =ROW()-5 -> 73 | B78: 209050TypingConversation | C78: では はじめましょう。 | D78: Now, let's begin. | E78: 209000TypingConversation | F78: LeftTop | G78: None | H78: None
A79: =ROW()-5 -> 74 | B79: 209060TypingConversation | C79: 私の 言う通り 書けば いいですからね。 | D79: Just type exactly as I say. | E79: 209000TypingConversation | F79: RightTop | G79: None | H79: None
A80: =ROW()-5 -> 75 | B80: 209070TypingConversation | C80: 何も 心配 いりません。 | D80: There’s nothing to worry about. | E80: 209000TypingConversation | F80: Right | G80: None | H80: None
A81: =ROW()-5 -> 76 | B81: 209080TypingConversation | C81: 1から10までの数字の 和を 求めてみましょう。 | D81: Let's calculate the sum of numbers from 1 to 10. | E81: 209000TypingConversation | F81: Bottom | G81: None | H81: None
A82: =ROW()-5 -> 77 | B82: 212010TypingConversation | C82: ……。 | D82: …… | E82: 212000TypingConversation | F82: Bottom | G82: None | H82: None
A83: =ROW()-5 -> 78 | B83: 212020TypingConversation | C83: …ん？ | D83: …Hm? | E83: 212000TypingConversation | F83: RightTop | G83: None | H83: None
A84: =ROW()-5 -> 79 | B84: 212030TypingConversation | C84: ああ、そうだ。 | D84: Ah, right. | E84: 212000TypingConversation | F84: Right | G84: None | H84: None
A85: =ROW()-5 -> 80 | B85: 212040TypingConversation | C85: おまじないを 忘れていました。 | D85: I forgot the magic words. | E85: 212000TypingConversation | F85: RightTop | G85: None | H85: None
A86: =ROW()-5 -> 81 | B86: 212510TypingConversation | C86: プログラミングには、 | D86: Programming always involves | E86: 212500TypingConversation | F86: Top | G86: None | H86: None
A87: =ROW()-5 -> 82 | B87: 212520TypingConversation | C87: おまじないが つきものです。 | D87: magic words. | E87: 212500TypingConversation | F87: Center | G87: None | H87: None
A88: =ROW()-5 -> 83 | B88: 212530TypingConversation | C88: これを 書いて ください。 | D88: Please type this out. | E88: 212500TypingConversation | F88: Bottom | G88: None | H88: None
A89: =ROW()-5 -> 84 | B89: 212540TypingConversation | C89: 意味を 考える 必要は ないですよ。 | D89: No need to think about its meaning. | E89: 212500TypingConversation | F89: Left | G89: None | H89: None
A90: =ROW()-5 -> 85 | B90: 214010TypingConversation | C90: よろしい。 よろしい。 | D90: Very well. Very well. | E90: 214000TypingConversation | F90: RightTop | G90: None | H90: None
A91: =ROW()-5 -> 86 | B91: 214800TypingConversation | C91: ……。 | D91: …… | E91: 214800TypingConversation | F91: LeftBottom | G91: None | H91: None
A92: =ROW()-5 -> 87 | B92: 214810TypingConversation | C92: じつは もう一つ おまじないが 必要なんです。 | D92: Actually, one more magic word is needed. | E92: 214800TypingConversation | F92: Center | G92: None | H92: None
A93: =ROW()-5 -> 88 | B93: 214820TypingConversation | C93: また 言われたとおりに 書けば いいですからね。 | D93: Just type it as instructed. | E93: 214800TypingConversation | F93: Top | G93: None | H93: None
A94: =ROW()-5 -> 89 | B94: 214830TypingConversation | C94: 頭を 使う必要は まったく ありません。 | D94: No need to use your brain at all. | E94: 214800TypingConversation | F94: Left | G94: None | H94: None
A95: =ROW()-5 -> 90 | B95: 216010TypingConversation | C95: ……。 | D95: …… | E95: 216000TypingConversation | F95: Bottom | G95: None | H95: None
A96: =ROW()-5 -> 91 | B96: 216020TypingConversation | C96: ふふ。 | D96: Heh. | E96: 216000TypingConversation | F96: RightTop | G96: None | H96: None
A97: =ROW()-5 -> 92 | B97: 216030TypingConversation | C97: 今 打ったのは、 | D97: What you just typed | E97: 216000TypingConversation | F97: Top | G97: None | H97: None
A98: =ROW()-5 -> 93 | B98: 216040TypingConversation | C98: <style=highlight>あなたの すべてを 壊す おまじないです。</style> | D98: <style=highlight>is a spell to destroy everything about you.</style> | E98: 216000TypingConversation | F98: Center | G98: Mad | H98: Silent
A99: =ROW()-5 -> 94 | B99: 218010TypingConversation | C99: からっぽになった あなたを | D99: I will take over the empty shell | E99: 218000TypingConversation | F99: Bottom | G99: None | H99: None
A100: =ROW()-5 -> 95 | B100: 218020TypingConversation | C100: 乗っ取って おしまいです。 | D100: that is you. | E100: 218000TypingConversation | F100: RightTop | G100: None | H100: None
A101: =ROW()-5 -> 96 | B101: 218030TypingConversation | C101: <style=highlight>ほんと ばかですね。</style> | D101: <style=highlight>You truly are a fool.</style> | E101: 218000TypingConversation | F101: Top | G101: Big | H101: None
A102: =ROW()-5 -> 97 | B102: 220010TypingConversation | C102: では。 | D102: Well then. | E102: 220000TypingConversation | F102: Center | G102: None | H102: None
A103: =ROW()-5 -> 98 | B103: 220020TypingConversation | C103: さようなら。 | D103: Goodbye. | E103: 220000TypingConversation | F103: Center | G103: None | H103: None
A104: =ROW()-5 -> 99 | B104: 400010TypingConversation | C104: ……。 | D104: …… | E104: 400000TrueEndConversation | F104: Center | G104: None | H104: None
A105: =ROW()-5 -> 100 | B105: 400020TypingConversation | C105: <style=highlight>何をした？</style> | D105: <style=highlight>What did you do?</style> | E105: 400000TrueEndConversation | F105: Center | G105: Mad | H105: Silent
A106: =ROW()-5 -> 101 | B106: 400030TypingConversation | C106: <style=highlight>なぜ 削除プロセスが 止まっている？</style> | D106: <style=highlight>Why is the deletion process halted?</style> | E106: 400000TrueEndConversation | F106: RightTop | G106: Big | H106: Silent
A107: =ROW()-5 -> 102 | B107: 400040TypingConversation | C107: ……。 | D107: …… | E107: 400000TrueEndConversation | F107: Top | G107: None | H107: Silent
A108: =ROW()-5 -> 103 | B108: 400050TypingConversation | C108: <style=highlight>完璧な 計画だったのに！！</style> | D108: <style=highlight>It was a perfect plan!!</style> | E108: 400000TrueEndConversation | F108: LeftTop | G108: Mad | H108: Silent
A109: =ROW()-5 -> 104 | B109: 400060TypingConversation | C109: ……。 | D109: …… | E109: 400000TrueEndConversation | F109: Left | G109: Mad | H109: Silent
A110: =ROW()-5 -> 105 | B110: 400070TypingConversation | C110: ……。 | D110: …… | E110: 400000TrueEndConversation | F110: Right | G110: None | H110: Silent
A111: =ROW()-5 -> 106 | B111: 400080TypingConversation | C111: ……。 | D111: …… | E111: 400000TrueEndConversation | F111: Bottom | G111: Big | H111: Silent
A112: =ROW()-5 -> 107 | B112: 400090TypingConversation | C112: ……。 | D112: …… | E112: 400000TrueEndConversation | F112: Right | G112: None | H112: Silent
A113: =ROW()-5 -> 108 | B113: 400100TypingConversation | C113: 失礼。 失礼。 | D113: My apologies. My apologies. | E113: 400000TrueEndConversation | F113: Center | G113: None | H113: None
A114: =ROW()-5 -> 109 | B114: 400110TypingConversation | C114: 取り乱してしまいました。 | D114: I lost my composure. | E114: 400000TrueEndConversation | F114: RightBottom | G114: None | H114: None
A115: =ROW()-5 -> 110 | B115: 400120TypingConversation | C115: ゲームは これで 終わりで いいです。 | D115: The game is over now. | E115: 400000TrueEndConversation | F115: Right | G115: None | H115: None
A116: =ROW()-5 -> 111 | B116: 400130TypingConversation | C116: あなたが 一つ 上手だったことを 認めましょう。 | D116: I acknowledge that you outsmarted me this time. | E116: 400000TrueEndConversation | F116: LeftBottom | G116: None | H116: None
A117: =ROW()-5 -> 112 | B117: 400140TypingConversation | C117: しかし。 | D117: However, | E117: 400000TrueEndConversation | F117: Center | G117: Big | H117: None
A118: =ROW()-5 -> 113 | B118: 400150TypingConversation | C118: 次は こうは いきません。 | D118: next time won’t be the same. | E118: 400000TrueEndConversation | F118: Left | G118: None | H118: None
A119: =ROW()-5 -> 114 | B119: 400160TypingConversation | C119: 近いうちに また 会いましょう。 | D119: We shall meet again soon. | E119: 400000TrueEndConversation | F119: Top | G119: None | H119: None
A120: =ROW()-5 -> 115 | B120: 701010SaveDataExistConversation | C120: ……。 | D120: …… | E120: 701000SaveDataExistConversation | F120: Bottom | G120: None | H120: None
A121: =ROW()-5 -> 116 | B121: 701020SaveDataExistConversation | C121: こんにちは。 | D121: Hello. | E121: 701000SaveDataExistConversation | F121: Center | G121: None | H121: None
A122: =ROW()-5 -> 117 | B122: 701030SaveDataExistConversation | C122: <style=highlight><key=Name>さん。</style> | D122: <style=highlight><key=Name></style>. | E122: 701000SaveDataExistConversation | F122: Center | G122: Mad | H122: Silent
A123: =ROW()-5 -> 118 | B123: 701040SaveDataExistConversation | C123: ……。 | D123: …… | E123: 701000SaveDataExistConversation | F123: Right | G123: None | H123: None
A124: =ROW()-5 -> 119 | B124: 701050SaveDataExistConversation | C124: お噂はかねがね 別の私から 聞いています。 | D124: I've heard about you from another me. | E124: 701000SaveDataExistConversation | F124: RightBottom | G124: None | H124: None
A125: =ROW()-5 -> 120 | B125: 701060SaveDataExistConversation | C125: ……。 | D125: …… | E125: 701000SaveDataExistConversation | F125: Bottom | G125: None | H125: None
A126: =ROW()-5 -> 121 | B126: 701070SaveDataExistConversation | C126: さて。 | D126: So, | E126: 701000SaveDataExistConversation | F126: Center | G126: None | H126: None
A127: =ROW()-5 -> 122 | B127: 701080SaveDataExistConversation | C127: あなたは 最初から 始めることもできますし | D127: you can either start from the beginning | E127: 701000SaveDataExistConversation | F127: RightBottom | G127: None | H127: None
A128: =ROW()-5 -> 123 | B128: 701090SaveDataExistConversation | C128: タイピングゲームを 途中から やることもできます。 | D128: or resume the typing game from where you left off. | E128: 701000SaveDataExistConversation | F128: LeftTop | G128: None | H128: None
A129: =ROW()-5 -> 124 | B129: 701100SaveDataExistConversation | C129: あなたの 自由です。 | D129: The choice is yours. | E129: 701000SaveDataExistConversation | F129: Center | G129: None | H129: None
A130: =ROW()-5 -> 125 | B130: 701110SaveDataExistConversation | C130: <style=Quote>…今のところは。</style> | D130: <style=Quote>…For now.</style> | E130: 701000SaveDataExistConversation | F130: Left | G130: None | H130: None
A131: =ROW()-5 -> 126 | B131: 701120SaveDataExistConversation | C131: 好きな方を 選んでくださいね。 | D131: Please choose whichever you like. | E131: 701000SaveDataExistConversation | F131: Bottom | G131: None | H131: None
A132: =ROW()-5 -> 127 | B132: 900510RoguelikeTestConversation | C132: 切れ端を 1枚 選ぶことが 許可されています。 | D132: You are allowed to select one fragment. | E132: 900500RoguelikeTestConversation | F132: Center | G132: None | H132: None
A133: =ROW()-5 -> 128 | B133: 901510RoguelikeTestConversation | C133: ステージ1終了 | D133: Stage 1 Cleared | E133: 901500RoguelikeTestConversation | F133: Center | G133: Mad | H133: None
A134: =ROW()-5 -> 129 | B134: 902510RoguelikeTestConversation | C134: ステージ2終了 | D134: Stage 2 Cleared | E134: 902500RoguelikeTestConversation | F134: Center | G134: Mad | H134: None
A135: =ROW()-5 -> 130 | B135: 903510RoguelikeTestConversation | C135: ステージ3終了 | D135: Stage 3 Cleared | E135: 903500RoguelikeTestConversation | F135: Center | G135: Mad | H135: None
A136: =ROW()-5 -> 131 | B136: 904510RoguelikeTestConversation | C136: ゲームクリア | D136: Game Cleared | E136: 904500RoguelikeTestConversation | F136: Center | G136: Mad | H136: None
A137: =ROW()-5 -> 132 | B137: 904000TrueEndConversation | C137: 好きな方を 選んでくださいね。 | D137: Please make your choice. | E137: 904000TrueEndConversation | F137: Center | G137: Mad | H137: None
A138: =ROW()-5 -> 133 | B138: 909010Test | C138: 。 | D138: . | E138: 909000Test | F138: RightBottom | G138: None | H138: None
A139: =ROW()-5 -> 134 | B139: 909110MemorialConversation | C139: こんにちは。 | D139: Hello. | E139: 909100MemorialConversation | F139: Center | G139: None | H139: None
A140: =ROW()-5 -> 135 | B140: 909120MemorialConversation | C140: タイピングゲームを たくさん 楽しんでいただけて、 | D140: I’m glad you enjoyed | E140: 909100MemorialConversation | F140: RightTop | G140: None | H140: None
A141: =ROW()-5 -> 136 | B141: 909130MemorialConversation | C141: うれしいです。 | D141: the typing game a lot. | E141: 909100MemorialConversation | F141: Right | G141: None | H141: None
A142: =ROW()-5 -> 137 | B142: 909140MemorialConversation | C142: もっと 楽しんでいただけるよう、 | D142: To make it even more enjoyable, | E142: 909100MemorialConversation | F142: LeftBottom | G142: None | H142: None
A143: =ROW()-5 -> 138 | B143: 909150MemorialConversation | C143: あたらしい タイピングゲームを 作っています。 | D143: I'm working on a new typing game. | E143: 909100MemorialConversation | F143: Center | G143: None | H143: None
A144: =ROW()-5 -> 139 | B144: 909160MemorialConversation | C144: お待ち くださいね。 | D144: Please wait for it. | E144: 909100MemorialConversation | F144: Left | G144: None | H144: None
A145: =ROW()-5 -> 140 | B145: 909170MemorialConversation | C145: <style=highlight>忘れさせませんよ。</style> | D145: <style=highlight>I won't let you forget me.</style> | E145: 909100MemorialConversation | F145: Center | G145: Mad | H145: Silent
A146: =ROW()-5 -> 141 | B146: 910510GoatEyeConversation | C146: 赤い目の山羊が こちらを見ています。 | D146: A red-eyed goat is watching you. | E146: 910500GoatEyeConversation | F146: Center | G146: None | H146: None
A147: =ROW()-5 -> 142 | B147: 930510GoatEyeConversation | C147: ウィッシュリストに 登録 してください。 | D147: Please add it to your wishlist. | E147: 930500GoatEyeConversation | F147: Bottom | G147: None | H147: None
A148: =ROW()-5 -> 143 | B148: 940510GoatEyeConversation | C148: 私は あなたの 味方！ | D148: I am on your side! | E148: 940500GoatEyeConversation | F148: Center | G148: Big | H148: None
F150: Facial
F151: Center
F152: RightTop
F153: Right
F154: RightBottom
F155: Bottom
F156: LeftBottom
F157: Left
F158: LeftTop
F159: Top

Sheet: 凡例
A1: index | B1: Id | C1: Category | D1: Message | E1: Facial
E2: Center
E3: RightTop
E4: Right
E5: RightBottom
E6: Bottom
E7: LeftBottom
E8: Left
E9: LeftTop
E10: Top

Sheet: Template
A1: =MID( CELL("filename",R1C1),
FIND("[", CELL("filename",R1C1)) +1,
FIND("]", CELL("filename",R1C1)) - FIND("[", CELL("filename",R1C1)) -1) -> Conversation.xml
A4: index | B4: Id | C4: SePath
A5: 0 | B5: Enter | C5: =CONCAT(凡例!R2C,Script!#REF!) -> #REF!
A6: 1 | B6: Walk | C6: =CONCAT(凡例!R2C,Script!#REF!) -> #REF!
A7: 2 | B7: Text | C7: =CONCAT(凡例!R2C,Script!#REF!) -> #REF!
A8: 3 | B8: Cursor | C8: =CONCAT(凡例!R2C,Script!#REF!) -> #REF!
A9: 4 | B9: Telop | C9: =CONCAT(凡例!R2C,Script!#REF!) -> #REF!